{"$id":"urn:otqa:v1:dataset","$schema":"https://json-schema.org/draft/2020-12/schema","additionalProperties":false,"properties":{"cases":{"items":{"additionalProperties":false,"properties":{"case_id":{"pattern":"^[A-Za-z0-9][A-Za-z0-9._-]{0,127}$","type":"string"},"oracle":{"$ref":"urn:otqa:v1:common#/$defs/FileRef"},"problem":{"$ref":"urn:otqa:v1:common#/$defs/FileRef"}},"required":["case_id","problem","oracle"],"type":"object"},"minItems":1,"type":"array"},"dataset_id":{"pattern":"^[A-Za-z0-9][A-Za-z0-9._-]{0,127}$","type":"string"},"generator":{"anyOf":[{"type":"object"},{"type":"null"}]},"schema_version":{"const":1}},"required":["schema_version","dataset_id","generator","cases"],"type":"object"}
