{
  "cases": [
    {
      "case_id": "d7-m5-c000060",
      "oracle": {
        "path": "inputs/studies/d7-a5-n10-h2-grid5-grid-plus-ratio-adaptive-stop-single-candidate-minprog0p001-src72072-group07/oracles/d7-m5-c000060.json",
        "sha256": "b89377eca74bafa375ae336d827732a6db1ed301322da908d4e4f0ccd5e3623b"
      },
      "problem": {
        "path": "inputs/studies/d7-a5-n10-h2-grid5-grid-plus-ratio-adaptive-stop-single-candidate-minprog0p001-src72072-group07/problems/d7-m5-c000060.json",
        "sha256": "25ec4ff493e50c432f72b53aeac8a890522d88901889a73df48f3b5a2a9a2f5a"
      }
    },
    {
      "case_id": "d7-m5-c000061",
      "oracle": {
        "path": "inputs/studies/d7-a5-n10-h2-grid5-grid-plus-ratio-adaptive-stop-single-candidate-minprog0p001-src72072-group07/oracles/d7-m5-c000061.json",
        "sha256": "4bcde2a88d53d458d68aaa3cdc8dfa81b15aea1a7bfbc4ecb01eb06b8e7327ca"
      },
      "problem": {
        "path": "inputs/studies/d7-a5-n10-h2-grid5-grid-plus-ratio-adaptive-stop-single-candidate-minprog0p001-src72072-group07/problems/d7-m5-c000061.json",
        "sha256": "a772d1de655de226c29ecdec595a38ce537d29162b067ab0d6972f824eef0819"
      }
    },
    {
      "case_id": "d7-m5-c000062",
      "oracle": {
        "path": "inputs/studies/d7-a5-n10-h2-grid5-grid-plus-ratio-adaptive-stop-single-candidate-minprog0p001-src72072-group07/oracles/d7-m5-c000062.json",
        "sha256": "cb1408a22fc54b3be7ee61aba9884e2a789af6bcd9dd32c86b232086afb6fcac"
      },
      "problem": {
        "path": "inputs/studies/d7-a5-n10-h2-grid5-grid-plus-ratio-adaptive-stop-single-candidate-minprog0p001-src72072-group07/problems/d7-m5-c000062.json",
        "sha256": "87b98735f91e0e2fe7f8f363883f1314d18b5ac31c9e9ffa11a64caa8bb89fb1"
      }
    },
    {
      "case_id": "d7-m5-c000063",
      "oracle": {
        "path": "inputs/studies/d7-a5-n10-h2-grid5-grid-plus-ratio-adaptive-stop-single-candidate-minprog0p001-src72072-group07/oracles/d7-m5-c000063.json",
        "sha256": "b2ae624e6282c21172d3d942bd4430f81f406412b7ca9d3ec28e9d63e398f8e0"
      },
      "problem": {
        "path": "inputs/studies/d7-a5-n10-h2-grid5-grid-plus-ratio-adaptive-stop-single-candidate-minprog0p001-src72072-group07/problems/d7-m5-c000063.json",
        "sha256": "a80a50badc868464f615e00146803d2a31c9ba92e7695b21ba280186521237de"
      }
    },
    {
      "case_id": "d7-m5-c000064",
      "oracle": {
        "path": "inputs/studies/d7-a5-n10-h2-grid5-grid-plus-ratio-adaptive-stop-single-candidate-minprog0p001-src72072-group07/oracles/d7-m5-c000064.json",
        "sha256": "f973f3cbfc9513d61002ebb6ce9d9fbc5076a344fd4c36f111a251e5ec4fe4d9"
      },
      "problem": {
        "path": "inputs/studies/d7-a5-n10-h2-grid5-grid-plus-ratio-adaptive-stop-single-candidate-minprog0p001-src72072-group07/problems/d7-m5-c000064.json",
        "sha256": "550e37ec869e84ed57e198c9218362ac8756ab8c3a0e0f6e03f1da741b66ee02"
      }
    },
    {
      "case_id": "d7-m5-c000065",
      "oracle": {
        "path": "inputs/studies/d7-a5-n10-h2-grid5-grid-plus-ratio-adaptive-stop-single-candidate-minprog0p001-src72072-group07/oracles/d7-m5-c000065.json",
        "sha256": "96ac590e1749867dc101e021504045412d5c45b045bcdccc7c305ce7861baf33"
      },
      "problem": {
        "path": "inputs/studies/d7-a5-n10-h2-grid5-grid-plus-ratio-adaptive-stop-single-candidate-minprog0p001-src72072-group07/problems/d7-m5-c000065.json",
        "sha256": "756b6b17e105d34dffe7dbbfe3b589bf73933143bb7371cf2fbd15136ed8d808"
      }
    },
    {
      "case_id": "d7-m5-c000066",
      "oracle": {
        "path": "inputs/studies/d7-a5-n10-h2-grid5-grid-plus-ratio-adaptive-stop-single-candidate-minprog0p001-src72072-group07/oracles/d7-m5-c000066.json",
        "sha256": "87532cb334e44da8040d08071004193662e9820a4628902cdf6bbd2c32ec9f72"
      },
      "problem": {
        "path": "inputs/studies/d7-a5-n10-h2-grid5-grid-plus-ratio-adaptive-stop-single-candidate-minprog0p001-src72072-group07/problems/d7-m5-c000066.json",
        "sha256": "7174c7af29f5e5dfaf1bfb265b13e5796d15f88237d6f308e0003b65c007d791"
      }
    },
    {
      "case_id": "d7-m5-c000067",
      "oracle": {
        "path": "inputs/studies/d7-a5-n10-h2-grid5-grid-plus-ratio-adaptive-stop-single-candidate-minprog0p001-src72072-group07/oracles/d7-m5-c000067.json",
        "sha256": "75b53236cae1d680452e1570945fa6d575294db0036d9e87b22137c852d0e8d2"
      },
      "problem": {
        "path": "inputs/studies/d7-a5-n10-h2-grid5-grid-plus-ratio-adaptive-stop-single-candidate-minprog0p001-src72072-group07/problems/d7-m5-c000067.json",
        "sha256": "b064918b46bd69ecb3fef2db215d451ac76f8120242b76a25dc06b635b4c4113"
      }
    },
    {
      "case_id": "d7-m5-c000068",
      "oracle": {
        "path": "inputs/studies/d7-a5-n10-h2-grid5-grid-plus-ratio-adaptive-stop-single-candidate-minprog0p001-src72072-group07/oracles/d7-m5-c000068.json",
        "sha256": "55381993d4d1dc3aaf123e3f71fb50261df62e84728f5654d8f242e0f3aad176"
      },
      "problem": {
        "path": "inputs/studies/d7-a5-n10-h2-grid5-grid-plus-ratio-adaptive-stop-single-candidate-minprog0p001-src72072-group07/problems/d7-m5-c000068.json",
        "sha256": "782059f5c767f5beb5fce0532d331b07bdf9e0dd80c2d37fbff7d842fd28972f"
      }
    },
    {
      "case_id": "d7-m5-c000069",
      "oracle": {
        "path": "inputs/studies/d7-a5-n10-h2-grid5-grid-plus-ratio-adaptive-stop-single-candidate-minprog0p001-src72072-group07/oracles/d7-m5-c000069.json",
        "sha256": "f19f10c200bd1cee089aade7af95479573bea75fc12b58df43c856355a6bca82"
      },
      "problem": {
        "path": "inputs/studies/d7-a5-n10-h2-grid5-grid-plus-ratio-adaptive-stop-single-candidate-minprog0p001-src72072-group07/problems/d7-m5-c000069.json",
        "sha256": "49e124d7d8945c9eac993a1cedcd88b822ac6476505c14425979c4b77c403247"
      }
    }
  ],
  "dataset_id": "d7-a5-n10-h2-grid5-grid-plus-ratio-adaptive-stop-single-candidate-minprog0p001-src72072-group07",
  "generator": null,
  "schema_version": 1
}
