{
  "cases": [
    {
      "case_id": "d7-m5-c000030",
      "oracle": {
        "path": "inputs/studies/d7-a5-n10-h2-grid5-grid-plus-ratio-adaptive-stop-single-candidate-minprog0p001-src72072-group04/oracles/d7-m5-c000030.json",
        "sha256": "22a79625d8b7a4887ebd1a8775c355acde2bf77ba5498898ea019a48390de3d3"
      },
      "problem": {
        "path": "inputs/studies/d7-a5-n10-h2-grid5-grid-plus-ratio-adaptive-stop-single-candidate-minprog0p001-src72072-group04/problems/d7-m5-c000030.json",
        "sha256": "958f1629f29f0c353ddb457dd00a62b331f76c62b44817ebcda892d796c99ade"
      }
    },
    {
      "case_id": "d7-m5-c000031",
      "oracle": {
        "path": "inputs/studies/d7-a5-n10-h2-grid5-grid-plus-ratio-adaptive-stop-single-candidate-minprog0p001-src72072-group04/oracles/d7-m5-c000031.json",
        "sha256": "b3ce76610f9b4ee3ebdf986c55a77dec9562be5bd0ebe30fa6daaaf1c6ef07ec"
      },
      "problem": {
        "path": "inputs/studies/d7-a5-n10-h2-grid5-grid-plus-ratio-adaptive-stop-single-candidate-minprog0p001-src72072-group04/problems/d7-m5-c000031.json",
        "sha256": "81ba4e7bd3fcf8dca0bb8a5f4829a3812195ef6afb0a46af6094630f8566e03d"
      }
    },
    {
      "case_id": "d7-m5-c000032",
      "oracle": {
        "path": "inputs/studies/d7-a5-n10-h2-grid5-grid-plus-ratio-adaptive-stop-single-candidate-minprog0p001-src72072-group04/oracles/d7-m5-c000032.json",
        "sha256": "96c624b40ab1435f2509e2abae0a15f27a981d1cf3c8fe96376b1630e481d8fc"
      },
      "problem": {
        "path": "inputs/studies/d7-a5-n10-h2-grid5-grid-plus-ratio-adaptive-stop-single-candidate-minprog0p001-src72072-group04/problems/d7-m5-c000032.json",
        "sha256": "87ca6665d5cae9947be835e9748127c5428c91d60bfed53772ff8e3173b36c2d"
      }
    },
    {
      "case_id": "d7-m5-c000033",
      "oracle": {
        "path": "inputs/studies/d7-a5-n10-h2-grid5-grid-plus-ratio-adaptive-stop-single-candidate-minprog0p001-src72072-group04/oracles/d7-m5-c000033.json",
        "sha256": "0882dafe76a0e2362d2c12a865feac712291b37141a97b0530a54d9822ba3820"
      },
      "problem": {
        "path": "inputs/studies/d7-a5-n10-h2-grid5-grid-plus-ratio-adaptive-stop-single-candidate-minprog0p001-src72072-group04/problems/d7-m5-c000033.json",
        "sha256": "572053a95cf65312a89c5b85fe90697458c7b83f9d27b3e231850c6efae423ca"
      }
    },
    {
      "case_id": "d7-m5-c000034",
      "oracle": {
        "path": "inputs/studies/d7-a5-n10-h2-grid5-grid-plus-ratio-adaptive-stop-single-candidate-minprog0p001-src72072-group04/oracles/d7-m5-c000034.json",
        "sha256": "936c97cf77401e9f974fc7e1428f523845da6bb9a402fae4e6ed04c6f242a2c5"
      },
      "problem": {
        "path": "inputs/studies/d7-a5-n10-h2-grid5-grid-plus-ratio-adaptive-stop-single-candidate-minprog0p001-src72072-group04/problems/d7-m5-c000034.json",
        "sha256": "cd215189ff33bf5ec675f011ca4ead61ea5acd0889e1aa748c452f5a9861ccc4"
      }
    },
    {
      "case_id": "d7-m5-c000035",
      "oracle": {
        "path": "inputs/studies/d7-a5-n10-h2-grid5-grid-plus-ratio-adaptive-stop-single-candidate-minprog0p001-src72072-group04/oracles/d7-m5-c000035.json",
        "sha256": "a027f326a7f1bb08a1a4cc15dd8a3004c63e88a102a4cca1029fba24160c534b"
      },
      "problem": {
        "path": "inputs/studies/d7-a5-n10-h2-grid5-grid-plus-ratio-adaptive-stop-single-candidate-minprog0p001-src72072-group04/problems/d7-m5-c000035.json",
        "sha256": "0181bcbba2eab84e51f283d1c2dee60f00f9229f9af7c5074e0a99a748ef120a"
      }
    },
    {
      "case_id": "d7-m5-c000036",
      "oracle": {
        "path": "inputs/studies/d7-a5-n10-h2-grid5-grid-plus-ratio-adaptive-stop-single-candidate-minprog0p001-src72072-group04/oracles/d7-m5-c000036.json",
        "sha256": "8ab2923184ba1f7808b807bcd02d9e95f2674dad9049558fd27664e86c9e36ce"
      },
      "problem": {
        "path": "inputs/studies/d7-a5-n10-h2-grid5-grid-plus-ratio-adaptive-stop-single-candidate-minprog0p001-src72072-group04/problems/d7-m5-c000036.json",
        "sha256": "a256561618b8bb22f8211651e9fb1dabd79eacefbe3872f5027be34717362f57"
      }
    },
    {
      "case_id": "d7-m5-c000037",
      "oracle": {
        "path": "inputs/studies/d7-a5-n10-h2-grid5-grid-plus-ratio-adaptive-stop-single-candidate-minprog0p001-src72072-group04/oracles/d7-m5-c000037.json",
        "sha256": "9cb5ffe704314c6dd048ea439d3ffae15b062246f921da80c97c19a5a49e677d"
      },
      "problem": {
        "path": "inputs/studies/d7-a5-n10-h2-grid5-grid-plus-ratio-adaptive-stop-single-candidate-minprog0p001-src72072-group04/problems/d7-m5-c000037.json",
        "sha256": "ca75f445c7f1a3bf1e40e14e16328f46ca9a9885f18a48feb610f707f7dc2a5e"
      }
    },
    {
      "case_id": "d7-m5-c000038",
      "oracle": {
        "path": "inputs/studies/d7-a5-n10-h2-grid5-grid-plus-ratio-adaptive-stop-single-candidate-minprog0p001-src72072-group04/oracles/d7-m5-c000038.json",
        "sha256": "dc4504437f6dd4cc80612ad8b5cead4ab691011ec70fe79f3495e0600f30d8dd"
      },
      "problem": {
        "path": "inputs/studies/d7-a5-n10-h2-grid5-grid-plus-ratio-adaptive-stop-single-candidate-minprog0p001-src72072-group04/problems/d7-m5-c000038.json",
        "sha256": "3b6df5dc839c2c33f69f510b1cdec538edbb9bdee515f8ed0a27ecf8954a63be"
      }
    },
    {
      "case_id": "d7-m5-c000039",
      "oracle": {
        "path": "inputs/studies/d7-a5-n10-h2-grid5-grid-plus-ratio-adaptive-stop-single-candidate-minprog0p001-src72072-group04/oracles/d7-m5-c000039.json",
        "sha256": "00ed70306f4e88a8cbf80581d3f3cea5892cbb274907f3dc9633666f2e8d49a0"
      },
      "problem": {
        "path": "inputs/studies/d7-a5-n10-h2-grid5-grid-plus-ratio-adaptive-stop-single-candidate-minprog0p001-src72072-group04/problems/d7-m5-c000039.json",
        "sha256": "bd1aa9b3d97dc000a253ad026791735591cbfe36400d8cd86e141b72e26d13d1"
      }
    }
  ],
  "dataset_id": "d7-a5-n10-h2-grid5-grid-plus-ratio-adaptive-stop-single-candidate-minprog0p001-src72072-group04",
  "generator": null,
  "schema_version": 1
}
