{
  "cases": [
    {
      "case_id": "d7-m5-c000080",
      "oracle": {
        "path": "inputs/studies/d7-a5-n10-h2-grid5-grid-plus-ratio-adaptive-stop-single-candidate-minprog0p001-src72072-group09/oracles/d7-m5-c000080.json",
        "sha256": "d4d058c7405418efe2aea6b83cd8fa2053aba861ff1f12abde7eeb8de5e018ef"
      },
      "problem": {
        "path": "inputs/studies/d7-a5-n10-h2-grid5-grid-plus-ratio-adaptive-stop-single-candidate-minprog0p001-src72072-group09/problems/d7-m5-c000080.json",
        "sha256": "58d6d5ef0d5606ec6570ad2207a75bfb0ca272282453f609fedc052f03ea5a46"
      }
    },
    {
      "case_id": "d7-m5-c000081",
      "oracle": {
        "path": "inputs/studies/d7-a5-n10-h2-grid5-grid-plus-ratio-adaptive-stop-single-candidate-minprog0p001-src72072-group09/oracles/d7-m5-c000081.json",
        "sha256": "baf1649fe50a6e74c9db3b3bebc6e298e80c971e62e94754113d55a6693315cf"
      },
      "problem": {
        "path": "inputs/studies/d7-a5-n10-h2-grid5-grid-plus-ratio-adaptive-stop-single-candidate-minprog0p001-src72072-group09/problems/d7-m5-c000081.json",
        "sha256": "46029a61c68fb590bcfa68cb07d12704ccc260c72c0ef4e10b4632840d4e8a71"
      }
    },
    {
      "case_id": "d7-m5-c000082",
      "oracle": {
        "path": "inputs/studies/d7-a5-n10-h2-grid5-grid-plus-ratio-adaptive-stop-single-candidate-minprog0p001-src72072-group09/oracles/d7-m5-c000082.json",
        "sha256": "3939dddd8f115fc762d3fc39dbfab6c1195327567e73ec9aa2bf8f7cb043c1a3"
      },
      "problem": {
        "path": "inputs/studies/d7-a5-n10-h2-grid5-grid-plus-ratio-adaptive-stop-single-candidate-minprog0p001-src72072-group09/problems/d7-m5-c000082.json",
        "sha256": "fa3eb53b5e1fbf2d8824c2df6f216f7b9883a3dd7658579914d096ebe3a127cf"
      }
    },
    {
      "case_id": "d7-m5-c000083",
      "oracle": {
        "path": "inputs/studies/d7-a5-n10-h2-grid5-grid-plus-ratio-adaptive-stop-single-candidate-minprog0p001-src72072-group09/oracles/d7-m5-c000083.json",
        "sha256": "1d77c9fe2dfd5a7fd630f3b448e5907ec1e19ece77dc83bad392316ed70b7f86"
      },
      "problem": {
        "path": "inputs/studies/d7-a5-n10-h2-grid5-grid-plus-ratio-adaptive-stop-single-candidate-minprog0p001-src72072-group09/problems/d7-m5-c000083.json",
        "sha256": "138351dc4624dca9bf7d6cec8777323dcf9953d4d657fc02599adb53484dec9a"
      }
    },
    {
      "case_id": "d7-m5-c000084",
      "oracle": {
        "path": "inputs/studies/d7-a5-n10-h2-grid5-grid-plus-ratio-adaptive-stop-single-candidate-minprog0p001-src72072-group09/oracles/d7-m5-c000084.json",
        "sha256": "32c4893ef53591d8b5d02febdbbf1b58acbbb9465aa0c2865b1ae9d2bf2508c1"
      },
      "problem": {
        "path": "inputs/studies/d7-a5-n10-h2-grid5-grid-plus-ratio-adaptive-stop-single-candidate-minprog0p001-src72072-group09/problems/d7-m5-c000084.json",
        "sha256": "8895b5d7b8e4a8cf9cfa6b140a2c7f64e4cb3af7e26ceecfd7fb878a8817a564"
      }
    },
    {
      "case_id": "d7-m5-c000085",
      "oracle": {
        "path": "inputs/studies/d7-a5-n10-h2-grid5-grid-plus-ratio-adaptive-stop-single-candidate-minprog0p001-src72072-group09/oracles/d7-m5-c000085.json",
        "sha256": "72f58ca743ea0ecac92574b68cea5ae19f9abeb0491a53b27534148671b039ac"
      },
      "problem": {
        "path": "inputs/studies/d7-a5-n10-h2-grid5-grid-plus-ratio-adaptive-stop-single-candidate-minprog0p001-src72072-group09/problems/d7-m5-c000085.json",
        "sha256": "7b1c30fd4101e801606a0b86c7087491068bcff49ff2f19e20bdfcd05b181704"
      }
    },
    {
      "case_id": "d7-m5-c000086",
      "oracle": {
        "path": "inputs/studies/d7-a5-n10-h2-grid5-grid-plus-ratio-adaptive-stop-single-candidate-minprog0p001-src72072-group09/oracles/d7-m5-c000086.json",
        "sha256": "11ad69b3e14228c35b74fdcc25c04a9731b43f213e087304c44ef82f4eca817f"
      },
      "problem": {
        "path": "inputs/studies/d7-a5-n10-h2-grid5-grid-plus-ratio-adaptive-stop-single-candidate-minprog0p001-src72072-group09/problems/d7-m5-c000086.json",
        "sha256": "637232b0c0a3eff1e9377a3be62ba4af47f8a0203b6ae7c090c945f9e0642c11"
      }
    },
    {
      "case_id": "d7-m5-c000087",
      "oracle": {
        "path": "inputs/studies/d7-a5-n10-h2-grid5-grid-plus-ratio-adaptive-stop-single-candidate-minprog0p001-src72072-group09/oracles/d7-m5-c000087.json",
        "sha256": "caeedec49d2d4d7ccebfbfaf83202686a4a070b3e1c1dc32da2eb3b4b9123846"
      },
      "problem": {
        "path": "inputs/studies/d7-a5-n10-h2-grid5-grid-plus-ratio-adaptive-stop-single-candidate-minprog0p001-src72072-group09/problems/d7-m5-c000087.json",
        "sha256": "be6c04a47d8f0c3f5a832299f6f500cac33602ccd542fd71d13c8fed6a8f3efb"
      }
    },
    {
      "case_id": "d7-m5-c000088",
      "oracle": {
        "path": "inputs/studies/d7-a5-n10-h2-grid5-grid-plus-ratio-adaptive-stop-single-candidate-minprog0p001-src72072-group09/oracles/d7-m5-c000088.json",
        "sha256": "007ecaa77fd5c34a9a3ec08e8bfa0d4c4803112710a921cf1722b05247d04049"
      },
      "problem": {
        "path": "inputs/studies/d7-a5-n10-h2-grid5-grid-plus-ratio-adaptive-stop-single-candidate-minprog0p001-src72072-group09/problems/d7-m5-c000088.json",
        "sha256": "bae64e323b5ddbb464afa34b97ec0e8ab7e5c2912b0c05b39fd2de4213f37b97"
      }
    },
    {
      "case_id": "d7-m5-c000089",
      "oracle": {
        "path": "inputs/studies/d7-a5-n10-h2-grid5-grid-plus-ratio-adaptive-stop-single-candidate-minprog0p001-src72072-group09/oracles/d7-m5-c000089.json",
        "sha256": "22dadb2e7c9e9d2612d2bbb3c02d2a2c0fa35a9e48ff7684fd10b362eb4c02c2"
      },
      "problem": {
        "path": "inputs/studies/d7-a5-n10-h2-grid5-grid-plus-ratio-adaptive-stop-single-candidate-minprog0p001-src72072-group09/problems/d7-m5-c000089.json",
        "sha256": "3fba03d63b8891900aded8b6a0fc0539739c70ec1173e35f6f94b1199db7322d"
      }
    }
  ],
  "dataset_id": "d7-a5-n10-h2-grid5-grid-plus-ratio-adaptive-stop-single-candidate-minprog0p001-src72072-group09",
  "generator": null,
  "schema_version": 1
}
