{
  "cases": [
    {
      "case_id": "d7-m5-c000020",
      "oracle": {
        "path": "inputs/studies/d7-a5-n10-h2-grid5-grid-plus-ratio-countdown-stop-single-candidate-minprog0p001-src72072-group03/oracles/d7-m5-c000020.json",
        "sha256": "23edee67b12b290c89993f4074d15170118bf027ebad8b780df4ffe8e2d91743"
      },
      "problem": {
        "path": "inputs/studies/d7-a5-n10-h2-grid5-grid-plus-ratio-countdown-stop-single-candidate-minprog0p001-src72072-group03/problems/d7-m5-c000020.json",
        "sha256": "286d9bceaa6c676b10061e09779ad108ba5eea9a35c80a149cbfed86170dd371"
      }
    },
    {
      "case_id": "d7-m5-c000021",
      "oracle": {
        "path": "inputs/studies/d7-a5-n10-h2-grid5-grid-plus-ratio-countdown-stop-single-candidate-minprog0p001-src72072-group03/oracles/d7-m5-c000021.json",
        "sha256": "982f2bce6399f944cc8786c07a0cb2e67bf042d2f8ef3f4b1a6c8d473b6164fc"
      },
      "problem": {
        "path": "inputs/studies/d7-a5-n10-h2-grid5-grid-plus-ratio-countdown-stop-single-candidate-minprog0p001-src72072-group03/problems/d7-m5-c000021.json",
        "sha256": "0f981e123d34a48c6fb5e6c72e3e8acc4d05c0ebc474c2eed059dbad06fefa10"
      }
    },
    {
      "case_id": "d7-m5-c000022",
      "oracle": {
        "path": "inputs/studies/d7-a5-n10-h2-grid5-grid-plus-ratio-countdown-stop-single-candidate-minprog0p001-src72072-group03/oracles/d7-m5-c000022.json",
        "sha256": "b89f9ec62712131fb40430f5dfd0623c89abfaabea38b0c83710fca567692c17"
      },
      "problem": {
        "path": "inputs/studies/d7-a5-n10-h2-grid5-grid-plus-ratio-countdown-stop-single-candidate-minprog0p001-src72072-group03/problems/d7-m5-c000022.json",
        "sha256": "23bc40c70b4b85d833d2f990c9cc0dccea5d7f09ed17be6452f436eec71f981d"
      }
    },
    {
      "case_id": "d7-m5-c000023",
      "oracle": {
        "path": "inputs/studies/d7-a5-n10-h2-grid5-grid-plus-ratio-countdown-stop-single-candidate-minprog0p001-src72072-group03/oracles/d7-m5-c000023.json",
        "sha256": "17083836e33bdc7899176928b91da5dd7ecd3365349b6f7b14e87a57a8232d23"
      },
      "problem": {
        "path": "inputs/studies/d7-a5-n10-h2-grid5-grid-plus-ratio-countdown-stop-single-candidate-minprog0p001-src72072-group03/problems/d7-m5-c000023.json",
        "sha256": "78b4e40407d76cfe2815451e23f2681b4dfb9943abd1a17894ababa92cebb1fb"
      }
    },
    {
      "case_id": "d7-m5-c000024",
      "oracle": {
        "path": "inputs/studies/d7-a5-n10-h2-grid5-grid-plus-ratio-countdown-stop-single-candidate-minprog0p001-src72072-group03/oracles/d7-m5-c000024.json",
        "sha256": "621c9bad39515eece8d31a37cdc00770cc9ff163110c07557455d7140760da31"
      },
      "problem": {
        "path": "inputs/studies/d7-a5-n10-h2-grid5-grid-plus-ratio-countdown-stop-single-candidate-minprog0p001-src72072-group03/problems/d7-m5-c000024.json",
        "sha256": "96737c02286c3079e6877a02faa611edf7dcdeecfd24f45fb747b8c4281d7d63"
      }
    },
    {
      "case_id": "d7-m5-c000025",
      "oracle": {
        "path": "inputs/studies/d7-a5-n10-h2-grid5-grid-plus-ratio-countdown-stop-single-candidate-minprog0p001-src72072-group03/oracles/d7-m5-c000025.json",
        "sha256": "e28c5ed02d596354333b0debc36e8a28963a2edf19c0a677760c6db0ffe020cd"
      },
      "problem": {
        "path": "inputs/studies/d7-a5-n10-h2-grid5-grid-plus-ratio-countdown-stop-single-candidate-minprog0p001-src72072-group03/problems/d7-m5-c000025.json",
        "sha256": "ce3f3896f7dbb668685c1433898bc3f9bb6c55efe5109bb762efddcb1b651010"
      }
    },
    {
      "case_id": "d7-m5-c000026",
      "oracle": {
        "path": "inputs/studies/d7-a5-n10-h2-grid5-grid-plus-ratio-countdown-stop-single-candidate-minprog0p001-src72072-group03/oracles/d7-m5-c000026.json",
        "sha256": "228b4eab43a250f191ff6c75b939b51c2d4caf71c7230db99bbbd699f490a138"
      },
      "problem": {
        "path": "inputs/studies/d7-a5-n10-h2-grid5-grid-plus-ratio-countdown-stop-single-candidate-minprog0p001-src72072-group03/problems/d7-m5-c000026.json",
        "sha256": "8a9ab11a0a3db735bcf83f3196c534d381472d4e89dcfdf13672440652466735"
      }
    },
    {
      "case_id": "d7-m5-c000027",
      "oracle": {
        "path": "inputs/studies/d7-a5-n10-h2-grid5-grid-plus-ratio-countdown-stop-single-candidate-minprog0p001-src72072-group03/oracles/d7-m5-c000027.json",
        "sha256": "80c10a07598204c4066ee67328543097abeb2aff0b91d65606ea068b96be6df2"
      },
      "problem": {
        "path": "inputs/studies/d7-a5-n10-h2-grid5-grid-plus-ratio-countdown-stop-single-candidate-minprog0p001-src72072-group03/problems/d7-m5-c000027.json",
        "sha256": "9b10c0938e577653996e73a8e1fbdebf725cd006fa14bae551245c8385f7a9d0"
      }
    },
    {
      "case_id": "d7-m5-c000028",
      "oracle": {
        "path": "inputs/studies/d7-a5-n10-h2-grid5-grid-plus-ratio-countdown-stop-single-candidate-minprog0p001-src72072-group03/oracles/d7-m5-c000028.json",
        "sha256": "2805a2b77b6dcadf369cb7a52139410489ca9246a592594bac72f0196365794f"
      },
      "problem": {
        "path": "inputs/studies/d7-a5-n10-h2-grid5-grid-plus-ratio-countdown-stop-single-candidate-minprog0p001-src72072-group03/problems/d7-m5-c000028.json",
        "sha256": "c817aee670e62901698d46e4947c77c2873620654baa41d3a772289fd7230e45"
      }
    },
    {
      "case_id": "d7-m5-c000029",
      "oracle": {
        "path": "inputs/studies/d7-a5-n10-h2-grid5-grid-plus-ratio-countdown-stop-single-candidate-minprog0p001-src72072-group03/oracles/d7-m5-c000029.json",
        "sha256": "fc1dd05a16a33e986744a234ae95414859cf201b2de6a779399dd7e4b52786ae"
      },
      "problem": {
        "path": "inputs/studies/d7-a5-n10-h2-grid5-grid-plus-ratio-countdown-stop-single-candidate-minprog0p001-src72072-group03/problems/d7-m5-c000029.json",
        "sha256": "b2290068c54e4c983f68a7baa1c3f14ff9a13a95f7f6b75b0223008dc85b4c81"
      }
    }
  ],
  "dataset_id": "d7-a5-n10-h2-grid5-grid-plus-ratio-countdown-stop-single-candidate-minprog0p001-src72072-group03",
  "generator": null,
  "schema_version": 1
}
